Original_Name,Category,Subcategory,Second_level_Subcategory,roberta_squad,distilbert_sst
Клейкая лента UNIBOB 54928 19 мм х 5 м белая,Хранение и порядок,Ёмкости для хранения,Упаковочная клейкая лента,клейкая лента unibob 54928 19 мм х 5 м белая,клейкая лента unibob 54928 19 мм х 5 м белая
Стеллаж универсальный ФЕЛИКС ЛДСП 164х37х34 см антрацит,Хранение и порядок,Мебель для хранения,Книжные стеллажи,стеллаж универсальный феликс лдсп 164х37х34 см антрацит,стеллаж универсальный феликс лдсп 164х37х34 см антрацит
Боковая вешалка на полку Larvij L9718-300WH 308x35x35 см белая,Хранение и порядок,Гардеробные системы,Кронштейны и направляющие для гардеробных систем,боковая вешалка на полку larvij 300wh 308x35x35 см белая,боковая вешалка на полку larvij 300wh 308x35x35 см белая
Короб UNO 30х30х30 светло-серый,Хранение и порядок,Аксессуары для хранения,Короба для хранения,короб uno 30х30х30 светло-серый,короб uno 30х30х30 светло-серый
Чехол для одежды HAUSMANN синий 60х135 см,Хранение и порядок,Аксессуары для хранения,Чехлы для одежды,чехол одежды hausmann синий 60х135 см,чехол одежды hausmann синий 60х135 см
"Вешалка Palladium напольная с 2 перекладинами и сеткой внизу, черная",Хранение и порядок,Аксессуары для хранения,Вешалки напольные,вешалка palladium напольная с 2 перекладинами и сеткой внизу черная,вешалка palladium напольная с 2 перекладинами и сеткой внизу черная
"Кронштейн для телевизора 17""-42"" REXANT наклонно-поворотный 1 колено",Хранение и порядок,Полки и кронштейны,Кронштейны для телевизора,кронштейн телевизора 17-42 rexant наклонно-поворотный 1 колено,кронштейн телевизора 17-42 rexant наклонно-поворотный 1 колено
Стойка для стеллажа Титан GS-450 серебристая 2500x30x20 мм,Хранение и порядок,Хранение в гараже,Стеллажные системы хранения,стойка стеллажа титан серебристая 2500x30x20 мм,стойка стеллажа титан серебристая 2500x30x20 мм
Тумба для обуви Шведский Стандарт Сириус 60х143 см дуб венге,Хранение и порядок,Мебель для хранения,Обувницы,тумба обуви шведский стандарт сириус 60х143 см дуб венге,тумба обуви шведский стандарт сириус 60х143 см дуб венге
Контейнер 11 л пластиковый прозрачный 39*28*14 без крышки,Хранение и порядок,Ёмкости для хранения,Пластиковые контейнеры для хранения,контейнер 11 л пластиковый прозрачный 39*28*14 без крышки,контейнер 11 л пластиковый прозрачный 39*28*14 без крышки
Кронштейн для полки Larvij Митер белый 250х250х30 мм,Хранение и порядок,Мебель для хранения,Консоли,кронштейн полки larvij митер белый 250х250х30 мм,кронштейн полки larvij митер белый 250х250х30 мм
Комод 6 ящ деревянный 155х39х92 см,Хранение и порядок,Мебель для хранения,Комоды,комод 6 ящ деревянный 155х39х92 см,комод 6 ящ деревянный 155х39х92 см
"Комод Шведский Стандарт Варма 3 80х77х40 см, серый",Хранение и порядок,Мебель для хранения,Комоды,комод шведский стандарт варма 3 80х77х40 см серый,комод шведский стандарт варма 3 80х77х40 см серый
"Комод Феликс №2 6 ящиков напольный 80х48х123 см, альпийский дуб",Хранение и порядок,Мебель для хранения,Комоды,комод феликс №2 6 ящиков напольный 80х48х123 см альпийский дуб,комод феликс №2 6 ящиков напольный 80х48х123 см альпийский дуб
"Ящик Roxor Consumer с крышкой и клипсами 36 серия Home, голубой",Хранение и порядок,Хранение в гараже,Ящики и контейнеры для хранения в гараже,ящик roxor consumer с крышкой и клипсами 36 серия home голубой,ящик roxor consumer с крышкой и клипсами 36 серия home голубой
Короб UNO 30х30х30 темно-серый,Хранение и порядок,Аксессуары для хранения,Короба для хранения,короб uno 30х30х30 темно-серый,короб uno 30х30х30 темно-серый
Контейнер ROXBOX полипропиленовый 415х565х740 мм 120 л,Хранение и порядок,Ёмкости для хранения,Пластиковые контейнеры для хранения,контейнер roxbox полипропиленовый 415х565х740 мм 120 л,контейнер roxbox полипропиленовый 415х565х740 мм 120 л
"Банкетка для обуви Nika Б1/Ч 450x330x500 мм, черный",Хранение и порядок,Мебель для хранения,Обувницы,банкетка обуви nika б1/ч 450x330x500 мм черный,банкетка обуви nika б1/ч 450x330x500 мм черный
Контейнер для хранения в ассортименте с крышкой ROX BOX полипропилен 390х500х250 мм 36 л,Хранение и порядок,Хранение в гараже,Ящики и контейнеры для хранения в гараже,контейнер хранения в ассортименте с крышкой rox box полипропилен 390х500х250 мм 36 л,контейнер хранения в ассортименте с крышкой rox box полипропилен 390х500х250 мм 36 л
"Корзина стеллажная ""Колокольчик"", Д400 Ш310 В170, белый",Хранение и порядок,Ёмкости для хранения,Корзины для хранения,корзина стеллажная колокольчик д400 ш310 в170 белый,корзина стеллажная колокольчик д400 ш310 в170 белый
"Органайзер для хранения, 2 секции ""SNYGG"", Д200 Ш510 В180, серый",Хранение и порядок,Аксессуары для хранения,Короба для хранения,органайзер хранения 2 секции snygg д200 ш510 в180 серый,органайзер хранения 2 секции snygg д200 ш510 в180 серый
Кронштейн для полки Larvij Орнаментал бронза 200x13x200мм,Хранение и порядок,Полки и кронштейны,Кронштейны для полок,кронштейн полки larvij орнаментал бронза 200x13x200мм,кронштейн полки larvij орнаментал бронза 200x13x200мм
Вешалка Larvij 4 двойных крючка темная сосна 7х40 см,Хранение и порядок,Аксессуары для хранения,Вешалки настенные,вешалка larvij 4 двойных крючка темная сосна 7х40 см,вешалка larvij 4 двойных крючка темная сосна 7х40 см
Кронштейн для полки Larvij белый 73x434x12 мм,Хранение и порядок,Хранение в гараже,Навесные системы хранения,кронштейн полки larvij белый 73x434x12 мм,кронштейн полки larvij белый 73x434x12 мм
Держатель для перекладины Larvij L9231WH 291x72x30 см белый,Хранение и порядок,Гардеробные системы,Кронштейны и направляющие для гардеробных систем,держатель перекладины larvij 291x72x30 см белый,держатель перекладины larvij 291x72x30 см белый
"Стойка для стеллажа 150 см, светло-серая",Хранение и порядок,Хранение в гараже,Стеллажные системы хранения,стойка стеллажа 150 см светло-серая,стойка стеллажа 150 см светло-серая
Мебельный уголок ЕВРОПАРТНЕР пластиковый сосна 4 шт,Хранение и порядок,Мебельные комплектующие,Уголки мебельные,мебельный уголок европартнер пластиковый сосна 4 шт,мебельный уголок европартнер пластиковый сосна 4 шт
"Кронштейн для телевизора 17""-42"", наклонно-поворотный, 2 колена REXANT",Хранение и порядок,Полки и кронштейны,Кронштейны для телевизора,кронштейн телевизора 17-42 наклонно-поворотный 2 колена rexant,кронштейн телевизора 17-42 наклонно-поворотный 2 колена rexant
Мебельная панель ЛДСП 800х600х16 мм Сонома,Хранение и порядок,Мебельные комплектующие,Панели ЛДСП,мебельная панель лдсп 800х600х16 мм сонома,мебельная панель лдсп 800х600х16 мм сонома
Контейнер 45 л пластиковый прозрачный 56*39*28 без крышки,Хранение и порядок,Ёмкости для хранения,Пластиковые контейнеры для хранения,контейнер 45 л пластиковый прозрачный 56*39*28 без крышки,контейнер 45 л пластиковый прозрачный 56*39*28 без крышки
Мебельная панель ЛДСП 800х600х16 мм Белый 2008003001022,Хранение и порядок,Мебельные комплектующие,Панели ЛДСП,мебельная панель лдсп 800х600х16 мм белый 2008003001022,мебельная панель лдсп 800х600х16 мм белый 2008003001022
"Двухсторонняя клейкая лента UNIBOB, на тканевой основе 50мм х 25м",Хранение и порядок,Ёмкости для хранения,Упаковочная клейкая лента,двухсторонняя клейкая лента unibob на тканевой основе 50мм х 25м,двухсторонняя клейкая лента unibob на тканевой основе 50мм х 25м
Вешалка Larvij 4 двойных крючка сосна 7х36 см,Хранение и порядок,Аксессуары для хранения,"Вешалки, плечики для одежды",вешалка larvij 4 двойных крючка сосна 7х36 см,вешалка larvij 4 двойных крючка сосна 7х36 см
Контейнер 22 л пластиковый прозрачный 39*28*28 без крышки,Хранение и порядок,Ёмкости для хранения,Пластиковые контейнеры для хранения,контейнер 22 л пластиковый прозрачный 39*28*28 без крышки,контейнер 22 л пластиковый прозрачный 39*28*28 без крышки
Контейнер для хранения с крышкой ROXBOX 400х300х170 мм 16 л в ассортименте,Хранение и порядок,Ёмкости для хранения,Ящики для хранения,контейнер хранения с крышкой roxbox 400х300х170 мм 16 л в ассортименте,контейнер хранения с крышкой roxbox 400х300х170 мм 16 л в ассортименте
Стул детский 27х29х57 см,Хранение и порядок,Мебель для хранения,Стулья,стул детский 27х29х57 см,стул детский 27х29х57 см
Стул DIAMANTE жесткое сидение,Хранение и порядок,Мебель для хранения,Стулья,стул diamante жесткое сидение,стул diamante жесткое сидение
Кронштейн для полки Larvij белый 150x70x18 мм 2 шт,Хранение и порядок,Гардеробные системы,Кронштейны и направляющие для гардеробных систем,кронштейн полки larvij белый 150x70x18 мм 2 шт,кронштейн полки larvij белый 150x70x18 мм 2 шт
Кофр для хранения HAUSMANN ПЭТ/ПП 60х50х35 см,Хранение и порядок,Ёмкости для хранения,Ящики для хранения,кофр хранения hausmann пэт/пп 60х50х35 см,кофр хранения hausmann пэт/пп 60х50х35 см
"Ящик Феликс для шкафа 100x35х23 см, венге",Хранение и порядок,Мебель для хранения,Корпусная мебель,ящик феликс шкафа 100x35х23 см венге,ящик феликс шкафа 100x35х23 см венге
Стол Pinecrest акация 178x100x73 см,Хранение и порядок,Мебель для хранения,Столы,стол pinecrest акация 178x100x73 см,стол pinecrest акация 178x100x73 см
Корзина для хранения Keeplex Rattan 21 л 30х30х28 см морской песок,Хранение и порядок,Ёмкости для хранения,Корзины для хранения,корзина хранения keeplex rattan 21 л 30х30х28 см морской песок,корзина хранения keeplex rattan 21 л 30х30х28 см морской песок
"Тумба прикроватная Шведский стандарт Сириус 39х41х53 см, белая",Хранение и порядок,Мебель для хранения,Тумбы прикроватные,тумба прикроватная шведский стандарт сириус 39х41х53 см белая,тумба прикроватная шведский стандарт сириус 39х41х53 см белая
Мебельный уголок ЕВРОПАРТНЕР пластиковый белый 4 шт,Хранение и порядок,Мебельные комплектующие,Уголки мебельные,мебельный уголок европартнер пластиковый белый 4 шт,мебельный уголок европартнер пластиковый белый 4 шт
Полка для одежды Larvij L9994BL черный 903x406x15 мм,Хранение и порядок,Хранение в гараже,Навесные системы хранения,полка одежды larvij черный 903x406x15 мм,полка одежды larvij черный 903x406x15 мм
Кронштейн для полки Larvij Ютилити коричневый 300х250х45 мм,Хранение и порядок,Мебель для хранения,Консоли,кронштейн полки larvij ютилити коричневый 300х250х45 мм,кронштейн полки larvij ютилити коричневый 300х250х45 мм
Мебельный щит ЛДСП 80х30 см Дуб коми,Хранение и порядок,Мебельные комплектующие,Мебельные щиты ЛДСП,мебельный щит лдсп 80х30 см дуб коми,мебельный щит лдсп 80х30 см дуб коми
"Кронштейн для телевизора REXANT Home 23""-43"" наклонно-поворотный",Хранение и порядок,Полки и кронштейны,Кронштейны для телевизора,кронштейн телевизора rexant home 23-43 наклонно-поворотный,кронштейн телевизора rexant home 23-43 наклонно-поворотный
"Ящик Roxor Consumer с крышкой особопрочный 36 серия Rox Box Pro, антрацитовый",Хранение и порядок,Хранение в гараже,Ящики и контейнеры для хранения в гараже,ящик roxor consumer с крышкой особопрочный 36 серия rox box pro антрацитовый,ящик roxor consumer с крышкой особопрочный 36 серия rox box pro антрацитовый
"Дверь шкафа ФЕЛИКС ДВ193Х44СЗ-В1-1077 44,6х193,2 см таксония",Хранение и порядок,Мебель для хранения,Двери-купе,дверь шкафа феликс дв193х44сз-в1-1077 446х1932 см таксония,дверь шкафа феликс дв193х44сз-в1-1077 446х1932 см таксония
"Плед бежевый 150*200 см, фланель однотонный страйп, TexRepublic",Декор,Текстиль для дома,Пледы,плед бежевый 150*200 см фланель однотонный страйп texrepublic,плед бежевый 150*200 см фланель однотонный страйп texrepublic
"Обои вспененный винил под покраску антивандальные белые 1,06х25 м аф 4-12-005",Декор,Обои,Обои под покраску,обои вспененный винил под покраску антивандальные белые 106х25 м аф 4-12-005,обои вспененный винил под покраску антивандальные белые 106х25 м аф 4-12-005
Ковер Moldabela Shaggylama 1039-35325 серебристый 160х230 см,Декор,Ковры и коврики,Ковры с высоким ворсом,ковер moldabela shaggylama 1039-35325 серебристый 160х230 см,ковер moldabela shaggylama 1039-35325 серебристый 160х230 см
"Фигурка декоративная с часами ""Солдатик"" (LR44x1, не прилаг), L10 W9 H51 см",Декор,Декор интерьера,Декоративные предметы,фигурка декоративная с часами солдатик ( не прилаг) см,фигурка декоративная с часами солдатик ( не прилаг) см
Рулонная штора Уют Рига зеленый 100x175 см,Декор,Оформление окна,Рулонные шторы,рулонная штора уют рига зеленый 100x175 см,рулонная штора уют рига зеленый 100x175 см
Увлажнитель воздуха ультразвуковой PRIMERA HUP-E3056-LA,Декор,Декор для спальни,Увлажнители воздуха для спальни,увлажнитель воздуха ультразвуковой primera hup-la,увлажнитель воздуха ультразвуковой primera hup-la
Угол универсальный FORMAT 5004 78х57 мм белый,Декор,Обои,Декоративные профили и потолочные панели,угол универсальный format 5004 78х57 мм белый,угол универсальный format 5004 78х57 мм белый
Штора портьерная WITERRA 145 см 1 шт серая,Декор,Декор для детской комнаты,Шторы для детской,штора портьерная witerra 145 см 1 шт серая,штора портьерная witerra 145 см 1 шт серая
Наклейки декоративные Room Decor Bestkom Братва 3D 29x41 мм 9 шт,Декор,Декор для детской комнаты,Наклейки для детской,наклейки декоративные room decor bestkom братва 3d 29x41 мм 9 шт,наклейки декоративные room decor bestkom братва 3d 29x41 мм 9 шт
Увлажнитель воздуха ультразвуковой PRIMERA HUP-W3080-TA,Декор,Декор для спальни,Увлажнители воздуха для спальни,увлажнитель воздуха ультразвуковой primera hup-ta,увлажнитель воздуха ультразвуковой primera hup-ta
Штора блэкаут Канвас серо-голубая 150х260 см,Декор,Оформление окна,Готовые шторы,штора блэкаут канвас серо-голубая 150х260 см,штора блэкаут канвас серо-голубая 150х260 см
Плед PLAIN микрофибра Belezza сиреневый 140x200,Декор,Декор для спальни,Покрывала для спальни,плед plain микрофибра belezza сиреневый 140x200,плед plain микрофибра belezza сиреневый 140x200
"Зеркало ""Шопен дуб"" 450х1600 напольное",Декор,Декор для стен,Зеркала,зеркало шопен дуб 450х1600 напольное,зеркало шопен дуб 450х1600 напольное
"Часы настенные машина D33,5 122207",Декор,Декор для стен,Часы,часы настенные машина 5 122207,часы настенные машина 5 122207
Салфетка сервировочная пвх MARMITON Геометрия 30x45 см золото,Декор,Декор для кухни,Салфетки для стола,салфетка сервировочная пвх marmiton геометрия 30x45 см золото,салфетка сервировочная пвх marmiton геометрия 30x45 см золото
Эркер для карниза HOME ACCESSORY стальной сплав серебряный 140 мм d16 мм 1 шт,Декор,Карнизы для штор,Наборные карнизы,эркер карниза home accessory стальной сплав серебряный 140 мм мм 1 шт,эркер карниза home accessory стальной сплав серебряный 140 мм мм 1 шт
Штора тюлевая Legrand Софт 140х150 см 2 шт,Декор,Оформление окна,Тюль,штора тюлевая legrand софт 140х150 см 2 шт,штора тюлевая legrand софт 140х150 см 2 шт
Ковер GARDEN 0.6*1 дизайн E2784,Декор,Ковры и коврики,Ковры джут,ковер garden 06*1 дизайн,ковер garden 06*1 дизайн
Держатель для карниза 2 ряда ORBIS Комби золото антик 200 мм d20/28 мм,Декор,Карнизы для штор,Комплектующие для карнизов,держатель карниза 2 ряда orbis комби золото антик 200 мм /28 мм,держатель карниза 2 ряда orbis комби золото антик 200 мм /28 мм
Ковер Moldabela Viva 30 в ассортименте 160х230 см,Декор,Ковры и коврики,Ковры с высоким ворсом,ковер moldabela viva 30 в ассортименте 160х230 см,ковер moldabela viva 30 в ассортименте 160х230 см
Букет из сухоцветов Пшеница Фиолетовая 600мм,Декор,Декор интерьера,Искусственные цветы для интерьера,букет из сухоцветов пшеница фиолетовая 600мм,букет из сухоцветов пшеница фиолетовая 600мм
"Полка настенная Шведский Стандарт Фора 1.4 40х25х3.7 см, дуб беленый",Декор,Декор для стен,Декоративные полки,полка настенная шведский стандарт фора 14 40х25х37 см дуб беленый,полка настенная шведский стандарт фора 14 40х25х37 см дуб беленый
