Original_Name,Category,Subcategory,Second_level_Subcategory,roberta_squad,distilbert_sst
"Шпаклевка полимерная финишная супербелая ОСНОВИТ ЭКОНСИЛК PP38 W, 20 кг",Стройматериалы,Сухие строительные смеси,Шпаклевки,шпаклевка полимерная финишная супербелая основит эконсилк w 20 кг,шпаклевка полимерная финишная супербелая основит эконсилк w 20 кг
"Водоостанавливающая проникающая гидроизоляция ОСНОВИТ Акваскрин HC65, 8 кг",Стройматериалы,Теплоизоляция и шумоизоляция,Гидроизоляция,водоостанавливающая проникающая гидроизоляция основит акваскрин 8 кг,водоостанавливающая проникающая гидроизоляция основит акваскрин 8 кг
"Тележка платформенная со складной ручкой, грузоподъёмностью до 250 кг",Стройматериалы,Строительное оборудование,Тачки строительные,тележка платформенная со складной ручкой грузоподъёмностью до 250 кг,тележка платформенная со складной ручкой грузоподъёмностью до 250 кг
Гипсовая плитка настенная CasaVaga Старая плитка бордовая 21.5x6.5 см,Стройматериалы,Фасадные материалы,Декоративный камень,гипсовая плитка настенная casavaga старая плитка бордовая 215x65 см,гипсовая плитка настенная casavaga старая плитка бордовая 215x65 см
Таз строительный круглый 90 л,Стройматериалы,Строительные расходные материалы,Строительные ведра и емкости,таз строительный круглый 90 л,таз строительный круглый 90 л
"Сетка базальтовая кладочная FasadPro 25х25 мм, 0,5х50 м, 50/50 кН/м",Стройматериалы,Металлопрокат,Сетки армирующие,сетка базальтовая кладочная fasadpro 25х25 мм 05х50 м 50/50 кн/м,сетка базальтовая кладочная fasadpro 25х25 мм 05х50 м 50/50 кн/м
"Профнастил С-21 коричневый 2000х1050х0,35 мм",Стройматериалы,Фасадные материалы,Профнастил стеновой,профнастил с-21 коричневый 2000х1050х035 мм,профнастил с-21 коричневый 2000х1050х035 мм
Мешки ПВД XGLASS 1300*900  240л (рул/10шт.),Стройматериалы,Строительные расходные материалы,Мешки строительные,мешки пвд xglass 1300*900 240л (рул/10шт),мешки пвд xglass 1300*900 240л (рул/10шт)
Напыляемый утеплитель ПЕНОПЛЭКС FASTFIX 850 мл,Стройматериалы,Теплоизоляция и шумоизоляция,Теплоизоляция,напыляемый утеплитель пеноплэкс fastfix 850 мл,напыляемый утеплитель пеноплэкс fastfix 850 мл
"Мастика битумная DOCKE для гибкой черепицы 0,33 кг",Стройматериалы,Кровля и водосточные системы,Кровельные мастики,мастика битумная docke гибкой черепицы 033 кг,мастика битумная docke гибкой черепицы 033 кг
Шпаклевка финишная полимерная Церезит IN 95 25 кг,Стройматериалы,Сухие строительные смеси,Шпаклевки,шпаклевка финишная полимерная церезит in 95 25 кг,шпаклевка финишная полимерная церезит in 95 25 кг
Пенопласт ППС 16Ф 1200x1000x50 мм,Стройматериалы,Теплоизоляция и шумоизоляция,Теплоизоляция,пенопласт ппс 16ф 1200x1000x50 мм,пенопласт ппс 16ф 1200x1000x50 мм
H-профиль Docke PREMIUM Халва,Стройматериалы,Фасадные материалы,Сайдинг,h-профиль docke premium халва,h-профиль docke premium халва
Сетка стальная STRECK 15-Z кладочная холоднотянутая 300 мм х20 м,Стройматериалы,Металлопрокат,Сетки армирующие,сетка стальная streck 15-z кладочная холоднотянутая 300 мм х20 м,сетка стальная streck 15-z кладочная холоднотянутая 300 мм х20 м
Щипец Ондулин коричневый 100х21 см,Стройматериалы,Кровля и водосточные системы,Ондулин,щипец ондулин коричневый 100х21 см,щипец ондулин коричневый 100х21 см
"Клинкерная плитка Колорадо чёрная 24,5Х6,5 см",Стройматериалы,Фасадные материалы,Фасадная клинкерная плитка,клинкерная плитка колорадо чёрная 245х65 см,клинкерная плитка колорадо чёрная 245х65 см
"Керамическая плитка Керамин Амстердам камень коричневая 29,8х29,8 см",Стройматериалы,Фасадные материалы,Фасадная клинкерная плитка,керамическая плитка керамин амстердам камень коричневая 298х298 см,керамическая плитка керамин амстердам камень коричневая 298х298 см
Труба водосточная DOCKE 3 м красный,Стройматериалы,Кровля и водосточные системы,Водосточные системы и отливы,труба водосточная docke 3 м красный,труба водосточная docke 3 м красный
Финишный профиль Docke PREMIUM Халва,Стройматериалы,Фасадные материалы,Сайдинг,финишный профиль docke premium халва,финишный профиль docke premium халва
Шпаклевка финишная полимерная DANOGIPS SuperFinish белая 5 кг,Стройматериалы,Сухие строительные смеси,Шпаклевки,шпаклевка финишная полимерная danogips superfinish белая 5 кг,шпаклевка финишная полимерная danogips superfinish белая 5 кг
Профиль торцевой поликарбонатный 2100x6x4 мм,Стройматериалы,Кровля и водосточные системы,Поликарбонат,профиль торцевой поликарбонатный 2100x6x4 мм,профиль торцевой поликарбонатный 2100x6x4 мм
Шумоизоляция ROCKWOOL АКУСТИК БАТТС 100х600х1000 ММ 3 кв.м,Стройматериалы,Теплоизоляция и шумоизоляция,Шумоизоляция,шумоизоляция rockwool акустик баттс 100х600х1000 мм 3 квм,шумоизоляция rockwool акустик баттс 100х600х1000 мм 3 квм
Грунтовка глубокого проникновения Волма Интерьер 10 л,Стройматериалы,Сухие строительные смеси,Грунтовки,грунтовка глубокого проникновения волма интерьер 10 л,грунтовка глубокого проникновения волма интерьер 10 л
Поликарбонат сотовый терракот 3000х2100х10 мм,Стройматериалы,Кровля и водосточные системы,Поликарбонат,поликарбонат сотовый терракот 3000х2100х10 мм,поликарбонат сотовый терракот 3000х2100х10 мм
"Гипсовая плитка Monte Alba Айлэнд серая 38x9,5 см",Стройматериалы,Фасадные материалы,Декоративный камень,гипсовая плитка monte alba айлэнд серая 38x95 см,гипсовая плитка monte alba айлэнд серая 38x95 см
L-профиль потолочный  CESAL матовый белый 3000х25х25 мм,Стройматериалы,Подвесные потолки,Профили и углы для подвесных потолков,l-профиль потолочный cesal матовый белый 3000х25х25 мм,l-профиль потолочный cesal матовый белый 3000х25х25 мм
Уплотнительная лента KNAUF 30 мм х 3 м х 3 мм,Стройматериалы,Листовые материалы,Ленты уплотнительные для профилей гипсокартона,уплотнительная лента knauf 30 мм х 3 м х 3 мм,уплотнительная лента knauf 30 мм х 3 м х 3 мм
"Губка синтетическая, полиэфир 160х100х60мм",Стройматериалы,Сухие строительные смеси,Комплектующие для штукатурных работ и выравнивания полов,губка синтетическая полиэфир 160х100х60мм,губка синтетическая полиэфир 160х100х60мм
Клей для гибкой черепицы Bitumast ФИКСАТОР 10 л,Стройматериалы,Кровля и водосточные системы,Кровельные мастики,клей гибкой черепицы bitumast фиксатор 10 л,клей гибкой черепицы bitumast фиксатор 10 л
Плиточный клей эпоксидный LITOKOL Litoelastic 5 кг,Стройматериалы,Сухие строительные смеси,Клей для плитки и изоляции,плиточный клей эпоксидный litokol litoelastic 5 кг,плиточный клей эпоксидный litokol litoelastic 5 кг
"Профнастил Таврос С-21 оцинкованный 2000x1050х0,45 мм",Стройматериалы,Фасадные материалы,Профнастил стеновой,профнастил таврос с-21 оцинкованный 2000x1050х045 мм,профнастил таврос с-21 оцинкованный 2000x1050х045 мм
Плиточный клей цементный weber.vetonit Ultra fix 25 кг,Стройматериалы,Сухие строительные смеси,Клей для плитки и изоляции,плиточный клей цементный webervetonit ultra fix 25 кг,плиточный клей цементный webervetonit ultra fix 25 кг
Клей для газобетонных блоков Волма Монтаж 30 кг,Стройматериалы,Сухие строительные смеси,Клей для плитки и изоляции,клей газобетонных блоков волма монтаж 30 кг,клей газобетонных блоков волма монтаж 30 кг
Штукатурка универсальная гипсовая KNAUF ROTBAND серая 5 кг,Стройматериалы,Сухие строительные смеси,Штукатурки,штукатурка универсальная гипсовая knauf rotband серая 5 кг,штукатурка универсальная гипсовая knauf rotband серая 5 кг
ИЗОСПАН AQ PROFF гидро-ветрозащитная паропроницаемая мембрана 35 м2,Стройматериалы,Теплоизоляция и шумоизоляция,Пароизоляция,изоспан aq proff гидро-ветрозащитная паропроницаемая мембрана 35 м2,изоспан aq proff гидро-ветрозащитная паропроницаемая мембрана 35 м2
Планка карнизная Таврос коричневый 200х10 см,Стройматериалы,Кровля и водосточные системы,Металлочерепица,планка карнизная таврос коричневый 200х10 см,планка карнизная таврос коричневый 200х10 см
Штукатурка универсальная гипсовая KNAUF ROTBAND серая 10 кг,Стройматериалы,Сухие строительные смеси,Штукатурки,штукатурка универсальная гипсовая knauf rotband серая 10 кг,штукатурка универсальная гипсовая knauf rotband серая 10 кг
Профиль потолочный Албес Евро T 24/38 3700х24х38 мм,Стройматериалы,Подвесные потолки,Профили и углы для подвесных потолков,профиль потолочный албес евро t 24/38 3700х24х38 мм,профиль потолочный албес евро t 24/38 3700х24х38 мм
Пенопласт ПСБ-С 15У 1000х600х30 мм,Стройматериалы,Теплоизоляция и шумоизоляция,Теплоизоляция,пенопласт псб-с 15у 1000х600х30 мм,пенопласт псб-с 15у 1000х600х30 мм
Наливной пол ВОЛМА-Нивелир Экспресс 25кг,Стройматериалы,Сухие строительные смеси,Ровнители для пола,наливной пол волма-нивелир экспресс 25кг,наливной пол волма-нивелир экспресс 25кг
Гидроизоляция обмазочная UNIS ГИДРОСТОП W8 5 кг,Стройматериалы,Теплоизоляция и шумоизоляция,Гидроизоляция,гидроизоляция обмазочная unis гидростоп 5 кг,гидроизоляция обмазочная unis гидростоп 5 кг
Противоморозная добавка Cemmix CemFrio 1 л,Стройматериалы,Сухие строительные смеси,Добавки в растворы,противоморозная добавка cemmix cemfrio 1 л,противоморозная добавка cemmix cemfrio 1 л
Шпаклевка финишная полимерная ВОЛМА Готовая 16 кг,Стройматериалы,Сухие строительные смеси,Шпаклевки,шпаклевка финишная полимерная волма готовая 16 кг,шпаклевка финишная полимерная волма готовая 16 кг
"Профнастил С-21 красный 2000х1050х0,35 мм",Стройматериалы,Фасадные материалы,Профнастил стеновой,профнастил с-21 красный 2000х1050х035 мм,профнастил с-21 красный 2000х1050х035 мм
Сетка стальная STRECK 15-Z кладочная холоднотянутая 180 мм х20 м,Стройматериалы,Металлопрокат,Сетки армирующие,сетка стальная streck 15-z кладочная холоднотянутая 180 мм х20 м,сетка стальная streck 15-z кладочная холоднотянутая 180 мм х20 м
"Бензиновый генератор DAEWOO GDA 3500E 220B 3,2 кВт 18 л",Инструмент,Силовая техника,Генераторы,бензиновый генератор daewoo gda 3500e 220b 32 квт 18 л,бензиновый генератор daewoo gda 3500e 220b 32 квт 18 л
Дрель ударная P.I.T. PSB13-C8 950Вт,Инструмент,Электроинструменты,Дрели,дрель ударная pit 950вт,дрель ударная pit 950вт
Фреза карнизная ELITECH 1820.088700,Инструмент,Расходные материалы и оснастка,Фрезы по дереву,фреза карнизная elitech 1820088700,фреза карнизная elitech 1820088700
"Мини-патрон для электрогравёра STAYER 0,8-3,2 мм, посадочная резьба М8х0,75 мм",Инструмент,Расходные материалы и оснастка,Патроны для дрелей,мини-патрон электрогравёра stayer 08-32 мм посадочная резьба м8х075 мм,мини-патрон электрогравёра stayer 08-32 мм посадочная резьба м8х075 мм
Набор стамесок ЗУБР пластиковых 4 шт.,Инструмент,Ручной инструмент,"Напильники, стамески и рубанки",стамесок зубр пластиковых 4 шт,стамесок зубр пластиковых 4 шт
Клещи переставные ЗУБР 100/400 мм,Инструмент,Ручной инструмент,Строительные клещи и щипцы,клещи переставные зубр 100/400 мм,клещи переставные зубр 100/400 мм
Стремянка Tools Stool 1ст. с ящиком для инструментов,Инструмент,Хранение инструмента и рабочее место,Стремянки,стремянка tools stool 1ст с ящиком инструментов,стремянка tools stool 1ст с ящиком инструментов
"Нож STAYER ""PROFI"", туристический, пластиковые ножны, лезвие-110мм",Инструмент,Ручной инструмент,Ножи строительные и ножницы,нож stayer profi туристический пластиковые ножны лезвие-110мм,нож stayer profi туристический пластиковые ножны лезвие-110мм
Фрезер электрический РЕСАНТА ФМ-1300Э,Инструмент,Электроинструменты,Фрезеры,фрезер электрический ресанта фм-1300э,фрезер электрический ресанта фм-1300э
Ножницы по металлу KRAFTOOL левые усиленные 250 мм,Инструмент,Ручной инструмент,Ножницы по металу,ножницы по металлу kraftool левые усиленные 250 мм,ножницы по металлу kraftool левые усиленные 250 мм
Диск отрезной по камню ЗУБР 200 мм,Инструмент,Расходные материалы и оснастка,Отрезные диски ,диск отрезной по камню зубр 200 мм,диск отрезной по камню зубр 200 мм
"Краскопульт пневматический c верхним бачком ПРО 600 ЗУБР сопло 1,4 мм",Инструмент,Силовая техника,Пневмоинструмент,краскопульт пневматический c верхним бачком про 600 зубр сопло 14 мм,краскопульт пневматический c верхним бачком про 600 зубр сопло 14 мм
Фрезер электрический ЗУБР Мастер ФМ-1650 1650 Вт,Инструмент,Электроинструменты,Фрезеры,фрезер электрический зубр мастер фм-1650 1650 вт,фрезер электрический зубр мастер фм-1650 1650 вт
Уровень лазерный РЕСАНТА пл-3шк,Инструмент,Измерительные приборы и инструмент,Лазерные уровни,уровень лазерный ресанта пл-3шк,уровень лазерный ресанта пл-3шк
"Перфоратор ПОБЕДА П-20/620, SDS+",Инструмент,Электроинструменты,Перфораторы,перфоратор победа п-20/620 sds+,перфоратор победа п-20/620 sds+
Ручной электрический миксер CMI 1350 Вт,Инструмент,Электроинструменты,Миксеры строительные,ручной электрический миксер cmi 1350 вт,ручной электрический миксер cmi 1350 вт
Перфоратор КАЛИБР ЭП-800 (69183) 800 Вт,Инструмент,Электроинструменты,Перфораторы,перфоратор калибр эп-800 (69183) 800 вт,перфоратор калибр эп-800 (69183) 800 вт
Антенна наружная ТВ BAS-1108-P Селена аналоговая,Инструмент,Дом и безопасность,Аудио и видео,антенна наружная тв -p селена аналоговая,антенна наружная тв -p селена аналоговая
Ключ для патрона дрели STAYER 13 мм,Инструмент,Расходные материалы и оснастка,Патроны для дрелей,ключ патрона дрели stayer 13 мм,ключ патрона дрели stayer 13 мм
Угольник алюминиевый ВИХРЬ (73/11/3/4),Инструмент,Измерительные приборы и инструмент,"Угломеры, линейки",угольник алюминиевый вихрь (73/11/3/4),угольник алюминиевый вихрь (73/11/3/4)
"Набор торцевых головок STAYER 10 шт. 4-13 1/4""",Инструмент,Ручной инструмент,Торцевые головки,торцевых головок stayer 10 шт 4-13 1/4,торцевых головок stayer 10 шт 4-13 1/4
Штукатурное правило h-образное «ALUKOMTOOLS h- PLASTER» 200 см,Инструмент,Штукатурно-отделочный инструмент,Правила строительные,штукатурное правило h-образное «alukomtools h- plaster» 200 см,штукатурное правило h-образное «alukomtools h- plaster» 200 см
"Паяльная станция (паяльник + фен), модель R852AD+, LED дисплей REXANT",Инструмент,Сварочное оборудование,Паяльники и аксессуары,паяльная станция (паяльник + фен) + led дисплей rexant,паяльная станция (паяльник + фен) + led дисплей rexant
"Лист шлифовальный ЗУБР р60, 5 шт. 115х280 мм",Инструмент,Штукатурно-отделочный инструмент,Шлифовальные листы,лист шлифовальный зубр р60 5 шт 115х280 мм,лист шлифовальный зубр р60 5 шт 115х280 мм
Кабель PROconnect HDMI 2.0 Gold 15 м,Инструмент,Дом и безопасность,Комплектующие и расходные материалы д. компьютеров,кабель proconnect hdmi 20 gold 15 м,кабель proconnect hdmi 20 gold 15 м
Компрессор Patriot поршневой масляный Professional 24-320,Инструмент,Силовая техника,Компрессоры,компрессор patriot поршневой масляный professional 24-320,компрессор patriot поршневой масляный professional 24-320
Набор отвёрток ВИХРЬ (73/6/2/12),Инструмент,Ручной инструмент,Отвертки,отвёрток вихрь (73/6/2/12),отвёрток вихрь (73/6/2/12)
Правило трапеция «ALUKOMTOOLS-OPTIMAL PLASTER» 200 см,Инструмент,Штукатурно-отделочный инструмент,Правила строительные,правило трапеция «alukomtools-optimal plaster» 200 см,правило трапеция «alukomtools-optimal plaster» 200 см
Зажим ручной ЗУБР универсальный 250 мм,Инструмент,Фиксирующий инструмент,Пружинные зажимы,зажим ручной зубр универсальный 250 мм,зажим ручной зубр универсальный 250 мм
Шпатель профессиональный ЗУБР 80 мм,Инструмент,Штукатурно-отделочный инструмент,Шпатели,шпатель профессиональный зубр 80 мм,шпатель профессиональный зубр 80 мм
Бур SDS-PLUS STAYER 12х460 мм,Инструмент,Расходные материалы и оснастка,Буры и зубила,бур sds-plus stayer 12х460 мм,бур sds-plus stayer 12х460 мм
