Original_Name,Category,Subcategory,Second_level_Subcategory,roberta_squad,distilbert_sst
Затирка для швов цементная Церезит СЕ 40 Aquastatic серо-голубая 2 кг,Плитка,Затирки для плитки,Цементные затирки для плитки,затирка швов цементная церезит се 40 aquastatic серо-голубая 2 кг,затирка швов цементная церезит се 40 aquastatic серо-голубая 2 кг
Люк ревизионный 600x600 мм под плитку алюминевый Практика Барьер2,Плитка,Люки под плитку,Ревизионные люки напольные,люк ревизионный 600x600 мм под плитку алюминевый практика барьер2,люк ревизионный 600x600 мм под плитку алюминевый практика барьер2
Грунтовка универсальная Bitumast 5 л,Плитка,Плиточный клей и средства для укладки,Грунтовки под плитку,грунтовка универсальная bitumast 5 л,грунтовка универсальная bitumast 5 л
Алмазная коронка с центрирующим сверлом по керамограниту Maxprospa 30 мм,Плитка,Инструмент для работы с плиткой,Сверла и коронки по плитке,алмазная коронка с центрирующим сверлом по керамограниту maxprospa 30 мм,алмазная коронка с центрирующим сверлом по керамограниту maxprospa 30 мм
"Эпоксидная затирка Церезит CE89 Персик 828, 2,5 кг",Плитка,Затирки для плитки,Эпоксидные затирки,эпоксидная затирка церезит персик 828 25 кг,эпоксидная затирка церезит персик 828 25 кг
Плиточный клей цементный LITOKOL Litoplus K55 5 кг,Плитка,Плиточный клей и средства для укладки,Цементные клеи,плиточный клей цементный litokol litoplus 5 кг,плиточный клей цементный litokol litoplus 5 кг
"Керамогранит Cersanit Wood Concept Prime белый 21,8x89,8 см",Плитка,Плитка и керамогранит,Плитка для ванной комнаты,керамогранит cersanit wood concept prime белый 218x898 см,керамогранит cersanit wood concept prime белый 218x898 см
Люк ревизионный 480x380 мм под плитку алюминевый Контур,Плитка,Люки под плитку,Ревизионные люки скрытые,люк ревизионный 480x380 мм под плитку алюминевый контур,люк ревизионный 480x380 мм под плитку алюминевый контур
Керамическая плитка Gracia Ceramica RIBEIRA белый рельеф 30х50 см,Плитка,Плитка и керамогранит,Декоративные элементы для плитки,керамическая плитка gracia ceramica ribeira белый рельеф 30х50 см,керамическая плитка gracia ceramica ribeira белый рельеф 30х50 см
Керамогранит Керамин Vankuver серый 40х40 см,Плитка,Плитка и керамогранит,Керамогранит,керамогранит керамин vankuver серый 40х40 см,керамогранит керамин vankuver серый 40х40 см
"Угол для кафеля наружный пластиковый голубой 9-10 мм 2,5 м",Плитка,Плитка и керамогранит,Керамические уголки для ванной,угол кафеля наружный пластиковый голубой 9-10 мм 25 м,угол кафеля наружный пластиковый голубой 9-10 мм 25 м
Алмазная коронка с центрирующим сверлом по керамограниту Maxprospa 55 мм,Плитка,Инструмент для работы с плиткой,Сверла и коронки по плитке,алмазная коронка с центрирующим сверлом по керамограниту maxprospa 55 мм,алмазная коронка с центрирующим сверлом по керамограниту maxprospa 55 мм
"Керамическая плитка Керамин Амстердам рельеф коричневая 29,8х29,8 см",Плитка,Плитка и керамогранит,Клинкерная плитка,керамическая плитка керамин амстердам рельеф коричневая 298х298 см,керамическая плитка керамин амстердам рельеф коричневая 298х298 см
Грунтовка глубокого проникновения Волма Интерьер 10 л,Плитка,Плиточный клей и средства для укладки,Грунтовки под плитку,грунтовка глубокого проникновения волма интерьер 10 л,грунтовка глубокого проникновения волма интерьер 10 л
"Крестики для плитки Tech-KREP 2,5 мм 100 шт",Плитка,Инструмент для работы с плиткой,Крестики для плитки,крестики плитки tech-krep 25 мм 100 шт,крестики плитки tech-krep 25 мм 100 шт
Люк ревизионный 600х1000 мм под плитку алюминиевый Практика,Плитка,Люки под плитку,Ревизионные люки скрытые,люк ревизионный 600х1000 мм под плитку алюминиевый практика,люк ревизионный 600х1000 мм под плитку алюминиевый практика
Грунтовка для бетона Церезит CT 19 15 кг,Плитка,Плиточный клей и средства для укладки,Грунтовки под плитку,грунтовка бетона церезит ct 19 15 кг,грунтовка бетона церезит ct 19 15 кг
Керамогранит Керамин Грес светло-коричневый 40х40 см,Плитка,Плитка и керамогранит,Керамическая плитка,керамогранит керамин грес светло-коричневый 40х40 см,керамогранит керамин грес светло-коричневый 40х40 см
Керамогранит Staro Palacio серый 60x120 см,Плитка,Плитка и керамогранит,Напольная плитка,керамогранит staro palacio серый 60x120 см,керамогранит staro palacio серый 60x120 см
Крестики для плитки LUX-TOOLS 1 мм 250 шт,Плитка,Инструмент для работы с плиткой,Инструменты для укладки плитки,крестики плитки lux-tools 1 мм 250 шт,крестики плитки lux-tools 1 мм 250 шт
"Ступень клинкерная Вермонт светло-серая 29,8Х29,8 см",Плитка,Плитка и керамогранит,Клинкерная плитка,ступень клинкерная вермонт светло-серая 298х298 см,ступень клинкерная вермонт светло-серая 298х298 см
Плиточный клей цементный weber.vetonit EASY FIX 25 кг,Плитка,Плиточный клей и средства для укладки,Цементные клеи,плиточный клей цементный webervetonit easy fix 25 кг,плиточный клей цементный webervetonit easy fix 25 кг
Плиткорез на усиленной платформе STAYER 600 мм,Плитка,Инструмент для работы с плиткой,Плиткорезы,плиткорез на усиленной платформе stayer 600 мм,плиткорез на усиленной платформе stayer 600 мм
"Керамический уголок мрамор белый 20х3,5 см",Плитка,Плитка и керамогранит,Керамические уголки для ванной,керамический уголок мрамор белый 20х35 см,керамический уголок мрамор белый 20х35 см
Затирка для швов цементная Церезит СЕ 40 Aquastatic латте 2 кг,Плитка,Затирки для плитки,Цементные затирки для плитки,затирка швов цементная церезит се 40 aquastatic латте 2 кг,затирка швов цементная церезит се 40 aquastatic латте 2 кг
Керамогранит Staro Silk Nestle sky голубой 60x60 см,Плитка,Плитка и керамогранит,Керамогранит,керамогранит staro silk nestle sky голубой 60x60 см,керамогранит staro silk nestle sky голубой 60x60 см
Ревизионный люк EVECS нажимной 150х150,Плитка,Люки под плитку,Ревизионные люки открытого типа,ревизионный люк evecs нажимной 150х150,ревизионный люк evecs нажимной 150х150
Люк ревизионный 360х460 мм под плитку стальной ERA,Плитка,Люки под плитку,Ревизионные люки открытого типа,люк ревизионный 360х460 мм под плитку стальной era,люк ревизионный 360х460 мм под плитку стальной era
Стеклянная мозаика StarMosaic Metal золотая 30x30 см,Плитка,Плитка и керамогранит,Мозаика,стеклянная мозаика starmosaic metal золотая 30x30 см,стеклянная мозаика starmosaic metal золотая 30x30 см
"СВП BRAM'S: Микс КФ-1,0 мм 50 компл. (100 шт)",Плитка,Инструмент для работы с плиткой,Системы выравнивания для плитки,свп bram's микс кф-10 мм 50 компл (100 шт),свп bram's микс кф-10 мм 50 компл (100 шт)
Керамогранит Керамин Нью-Йорк серый 40x40 см,Плитка,Плитка и керамогранит,Керамическая плитка,керамогранит керамин нью-йорк серый 40x40 см,керамогранит керамин нью-йорк серый 40x40 см
Затирка ЦЕМЕНТНАЯ МУЛЬТИШОВ СВЕТЛО-БЕЖЕВЫЙ 2кг,Плитка,Затирки для плитки,Цементные затирки для плитки,затирка цементная мультишов светло-бежевый 2кг,затирка цементная мультишов светло-бежевый 2кг
"Крестики для плитки Tech-KREP 2,5 мм 100 шт",Плитка,Инструмент для работы с плиткой,Инструменты для укладки плитки,крестики плитки tech-krep 25 мм 100 шт,крестики плитки tech-krep 25 мм 100 шт
"Керамогранит Torso белый 60х120 см 1,44 кв.м",Плитка,Плитка и керамогранит,Керамогранит,керамогранит torso белый 60х120 см 144 квм,керамогранит torso белый 60х120 см 144 квм
Ролик плиткореза LUX-TOOLS Classic 22x6x5 мм,Плитка,Инструмент для работы с плиткой,Плиткорезы,ролик плиткореза lux-tools classic 22x6x5 мм,ролик плиткореза lux-tools classic 22x6x5 мм
Ревизионный люк EVECS нажимной 300х400,Плитка,Люки под плитку,Ревизионные люки открытого типа,ревизионный люк evecs нажимной 300х400,ревизионный люк evecs нажимной 300х400
Керамогранит Lavit Endless Карвинг белый 60x60 см,Плитка,Плитка и керамогранит,Плитка для ванной комнаты,керамогранит lavit endless карвинг белый 60x60 см,керамогранит lavit endless карвинг белый 60x60 см
Керамогранит Staro Oasis белый 60x60 см,Плитка,Плитка и керамогранит,Керамическая плитка,керамогранит staro oasis белый 60x60 см,керамогранит staro oasis белый 60x60 см
Люк ревизионный 218х318 мм под плитку пластиковый ERA,Плитка,Люки под плитку,Ревизионные люки открытого типа,люк ревизионный 218х318 мм под плитку пластиковый era,люк ревизионный 218х318 мм под плитку пластиковый era
Лобзик для кер.плит 150 мм,Плитка,Инструмент для работы с плиткой,Инструменты для укладки плитки,лобзик керплит 150 мм,лобзик керплит 150 мм
Дюбель-гвоздь Tecfi YZ потайная манжета нейлон 8x60 мм 30 шт,Крепеж и фурнитура,Крепеж,Дюбель-гвозди,дюбель-гвоздь tecfi yz потайная манжета нейлон 8x60 мм 30 шт,дюбель-гвоздь tecfi yz потайная манжета нейлон 8x60 мм 30 шт
"Проволока вязальная Tech-KREP сталь 1,2 мм моток 0,2 кг",Крепеж и фурнитура,Крепеж,Проволока,проволока вязальная tech-krep сталь 12 мм моток 02 кг,проволока вязальная tech-krep сталь 12 мм моток 02 кг
Сейф оружейный AIKO Чирок 1015 33 л,Крепеж и фурнитура,Товары для безопасности,Сейфы,сейф оружейный aiko чирок 1015 33 л,сейф оружейный aiko чирок 1015 33 л
Шнур полипропиленовый 4 мм 300 м 16-прядный,Крепеж и фурнитура,Такелаж,Веревки и канаты,шнур полипропиленовый 4 мм 300 м 16-прядный,шнур полипропиленовый 4 мм 300 м 16-прядный
Направляющая шариковая LEMAX Prof 35/400 мм,Крепеж и фурнитура,Мебельная фурнитура,Направляющие для ящиков,направляющая шариковая lemax prof 35/400 мм,направляющая шариковая lemax prof 35/400 мм
"Колесо на ось пневмат., протектор. рез., пластик.обод, подшип.скольж, D260 (20)",Крепеж и фурнитура,Мебельная фурнитура,Мебельные колеса,колесо на ось пневмат протектор рез пластикобод подшипскольж (20),колесо на ось пневмат протектор рез пластикобод подшипскольж (20)
Делиниатор резина концевой 610 мм,Крепеж и фурнитура,Товары для безопасности,Ленты сигнальные,делиниатор резина концевой 610 мм,делиниатор резина концевой 610 мм
Пластина перфорированная Tech-KREP 60х200х2 мм,Крепеж и фурнитура,Перфорированный крепеж,Пластины крепежные,пластина перфорированная tech-krep 60х200х2 мм,пластина перфорированная tech-krep 60х200х2 мм
Труба алюминиевая ЛУКА 1x15х15х2000 мм,Крепеж и фурнитура,Профили и листы,Металлически трубы,труба алюминиевая лука 1x15х15х2000 мм,труба алюминиевая лука 1x15х15х2000 мм
Гайка DIN 985 Стройбат с нейлоновой вставкой М12 2 шт,Крепеж и фурнитура,Крепеж,Гайки,гайка din 985 стройбат с нейлоновой вставкой м12 2 шт,гайка din 985 стройбат с нейлоновой вставкой м12 2 шт
Строп нерегулируемый Сибртех ленточный модель  «А» 2 карабина,Крепеж и фурнитура,Такелаж,Такелажные ремни и стропы,строп нерегулируемый сибртех ленточный «а» 2 карабина,строп нерегулируемый сибртех ленточный «а» 2 карабина
"Лента прямая 5000x15х0,55 мм",Крепеж и фурнитура,Перфорированный крепеж,Ленты монтажные перфорированные,лента прямая 5000x15х055 мм,лента прямая 5000x15х055 мм
Трос Tech-KREP PVC сталь в ПВХ изоляции DIN 3055 2 мм 10 м,Крепеж и фурнитура,Такелаж,Тросы,трос tech-krep pvc сталь в пвх изоляции din 3055 2 мм 10 м,трос tech-krep pvc сталь в пвх изоляции din 3055 2 мм 10 м
"Саморез ШСММ  Tech-Krep св. 4,2х25 мм 1000 шт",Крепеж и фурнитура,Крепеж,Саморезы,саморез шсмм tech-krep св 42х25 мм 1000 шт,саморез шсмм tech-krep св 42х25 мм 1000 шт
Шнур Tech-KREP полипропилен 12 мм,Крепеж и фурнитура,Такелаж,Веревки и канаты,шнур tech-krep полипропилен 12 мм,шнур tech-krep полипропилен 12 мм
Уголок крепежный равносторонний kur Стройбат 100х100х2 мм,Крепеж и фурнитура,Перфорированный крепеж,Уголки крепежные,уголок крепежный равносторонний kur стройбат 100х100х2 мм,уголок крепежный равносторонний kur стройбат 100х100х2 мм
Шпилька резьбовая LUX-TOOLS М10х44 мм 2 шт,Крепеж и фурнитура,Крепеж,Шпильки резьбовые,шпилька резьбовая lux-tools м10х44 мм 2 шт,шпилька резьбовая lux-tools м10х44 мм 2 шт
Гайка DIN 1624 Element забивная М8 6 шт,Крепеж и фурнитура,Крепеж,Гайки,гайка din 1624 element забивная м8 6 шт,гайка din 1624 element забивная м8 6 шт
Пластина перфорированная Стройбат угловая 65x130x50 мм,Крепеж и фурнитура,Перфорированный крепеж,Пластины крепежные,пластина перфорированная стройбат угловая 65x130x50 мм,пластина перфорированная стройбат угловая 65x130x50 мм
Шайба кузовная Стройбат M5 DIN 9021 250 шт,Крепеж и фурнитура,Крепеж,Шайбы,шайба кузовная стройбат din 9021 250 шт,шайба кузовная стройбат din 9021 250 шт
Шайба плоская DIN 125A М20 2 шт,Крепеж и фурнитура,Крепеж,Шайбы,шайба плоская din 125a м20 2 шт,шайба плоская din 125a м20 2 шт
Гайка DIN 934 Стройбат шестигранная М8 100 шт,Крепеж и фурнитура,Крепеж,Гайки,гайка din 934 стройбат шестигранная м8 100 шт,гайка din 934 стройбат шестигранная м8 100 шт
Гайка DIN 934 Стройбат шестигранная М6 200 шт,Крепеж и фурнитура,Крепеж,Гайки,гайка din 934 стройбат шестигранная м6 200 шт,гайка din 934 стройбат шестигранная м6 200 шт
"Заклепка Tech-KREP 3,2х8 мм 27 шт",Крепеж и фурнитура,Крепеж,Заклепки,заклепка tech-krep 32х8 мм 27 шт,заклепка tech-krep 32х8 мм 27 шт
Крючок мебельный KERRON Hooks KR 0310 OAB тройной бронзовый,Крепеж и фурнитура,Мебельная фурнитура,Крючки и вешалки настенные,крючок мебельный kerron hooks kr 0310 oab тройной бронзовый,крючок мебельный kerron hooks kr 0310 oab тройной бронзовый
Винт DIN 965 Стройбат крестообразный М6х60 мм 5 шт,Крепеж и фурнитура,Крепеж,Винты,винт din 965 стройбат крестообразный м6х60 мм 5 шт,винт din 965 стройбат крестообразный м6х60 мм 5 шт
Петля мебельная LEMAX Prof 2PCS-M400-90 комплект 2 шт,Крепеж и фурнитура,Мебельная фурнитура,Мебельные петли,петля мебельная lemax prof 2pcs- комплект 2 шт,петля мебельная lemax prof 2pcs- комплект 2 шт
Стеклодержатель лопатка с присоской 5х17мм (никель 10 шт),Крепеж и фурнитура,Крепеж,Стеклодержатели,стеклодержатель лопатка с присоской 5х17мм (никель 10 шт),стеклодержатель лопатка с присоской 5х17мм (никель 10 шт)
"Гвозди финишные 1,8х50 мм 500 г",Крепеж и фурнитура,Крепеж,Гвозди,гвозди финишные 18х50 мм 500 г,гвозди финишные 18х50 мм 500 г
Сейф оружейный ОХОТА-2,Крепеж и фурнитура,Товары для безопасности,Сейфы,сейф оружейный охота-2,сейф оружейный охота-2
Соединитель Tech-KREP 145х145х2 мм,Крепеж и фурнитура,Перфорированный крепеж,Пластины крепежные,соединитель tech-krep 145х145х2 мм,соединитель tech-krep 145х145х2 мм
Шайба нерж. кузовная DIN 9021  6мм (10 шт),Крепеж и фурнитура,Крепеж,Шайбы,шайба нерж кузовная din 9021 6мм (10 шт),шайба нерж кузовная din 9021 6мм (10 шт)
Уголок крепежный ассиметричный kuas Tech-KREP 120х40х1 мм белый,Крепеж и фурнитура,Перфорированный крепеж,Уголки крепежные,уголок крепежный ассиметричный kuas tech-krep 120х40х1 мм белый,уголок крепежный ассиметричный kuas tech-krep 120х40х1 мм белый
Шнур полипропиленовый 8 мм 30 м,Крепеж и фурнитура,Такелаж,Веревки и канаты,шнур полипропиленовый 8 мм 30 м,шнур полипропиленовый 8 мм 30 м
"Саморезы Tech-KREP 4,2х16 мм крестообразные по металлу 1500 шт",Крепеж и фурнитура,Крепеж,Саморезы,саморезы tech-krep 42х16 мм крестообразные по металлу 1500 шт,саморезы tech-krep 42х16 мм крестообразные по металлу 1500 шт
Дюбель-гвоздь Tecfi YZ цилиндрическая манжета нейлон 6x40 мм 150 шт,Крепеж и фурнитура,Крепеж,Дюбель-гвозди,дюбель-гвоздь tecfi yz цилиндрическая манжета нейлон 6x40 мм 150 шт,дюбель-гвоздь tecfi yz цилиндрическая манжета нейлон 6x40 мм 150 шт
Крючок мебельный Larvij тройной золото,Крепеж и фурнитура,Мебельная фурнитура,Крючки и вешалки настенные,крючок мебельный larvij тройной золото,крючок мебельный larvij тройной золото
Блокиратор угловой Palladium BS 4604 белый,Крепеж и фурнитура,Товары для безопасности,Детская безопасность,блокиратор угловой palladium bs 4604 белый,блокиратор угловой palladium bs 4604 белый
