Original_Name,Category,Subcategory,Second_level_Subcategory,roberta_squad,distilbert_sst
"Смеситель для кухни 35-09 с подключением к фильтру с питьевой водой, серебристый",Кухни,Мойки и смесители для кухни,Кухонные смесители,смеситель кухни 35-09 с подключением к фильтру с питьевой водой серебристый,смеситель кухни 35-09 с подключением к фильтру с питьевой водой серебристый
Молоток для мяса Silver,Кухни,Посуда для приготовления,Кухонная утварь,молоток мяса silver,молоток мяса silver
Поддон-сушилка в раковину BEROSSI Compakt слоновая кость,Кухни,Мойки и смесители для кухни,Аксессуары для кухонных моек,поддон-сушилка в раковину berossi compakt слоновая кость,поддон-сушилка в раковину berossi compakt слоновая кость
Смеситель на раковину с гигиеническим душем Focus,Кухни,Мойки и смесители для кухни,Кухонные смесители,смеситель на раковину с гигиеническим душем focus,смеситель на раковину с гигиеническим душем focus
"Банка для сыпучих продуктов BERGEN 2,5л пепельный жемчуг",Кухни,Кухонные аксессуары,Контейнеры и емкости для хранения продуктов,банка сыпучих продуктов bergen 25л пепельный жемчуг,банка сыпучих продуктов bergen 25л пепельный жемчуг
"Сушилка для посуды Lemax prof 57,5х27 см",Кухни,Пространство и порядок в кухне,Сушилки для посуды и столовых приборов,сушилка посуды lemax prof 575х27 см,сушилка посуды lemax prof 575х27 см
"Ковш Practic 1,3 л (роза)",Кухни,Посуда для приготовления,Ковши кухонные,ковш practic 13 л (роза),ковш practic 13 л (роза)
Панель МДФ листовая Дуб вотан 600х3050х4 мм,Кухни,Стеновые панели,Стеновые панели для кухни,панель мдф листовая дуб вотан 600х3050х4 мм,панель мдф листовая дуб вотан 600х3050х4 мм
Планка для столешницы тонкой угловая 1 шт,Кухни,Столешницы и комплектующие,Планки для столешниц,планка столешницы тонкой угловая 1 шт,планка столешницы тонкой угловая 1 шт
Корзина Lemax prof сталь хром 470x440x240 мм,Кухни,Пространство и порядок в кухне,Выдвижные системы для кухни,корзина lemax prof сталь хром 470x440x240 мм,корзина lemax prof сталь хром 470x440x240 мм
"Чайник электрический Kitfort KT-659-2, зелёный",Кухни,Мелкая бытовая техника,Электрические чайники,чайник электрический kitfort -2 зелёный,чайник электрический kitfort -2 зелёный
"Шкаф 80 напольный с ящиком Кейл 80Х85,6Х60 см",Кухни,Мебель для кухни,Кухонные шкафы,шкаф 80 напольный с ящиком кейл 80х856х60 см,шкаф 80 напольный с ящиком кейл 80х856х60 см
Органайзер для специй Sugar&Spice Honey прозрачный,Кухни,Посуда для сервировки,Предметы для специй,органайзер специй sugar&spice honey прозрачный,органайзер специй sugar&spice honey прозрачный
"Емкость д/хранения, Orondo, Стекло, 1300 МЛ",Кухни,Пространство и порядок в кухне,Банки и емкости,емкость д/хранения orondo стекло 1300 мл,емкость д/хранения orondo стекло 1300 мл
Электрическая варочная панель ORE CA30,Кухни,Бытовая техника для кухни,Кухонные плиты,электрическая варочная панель ore,электрическая варочная панель ore
"Универсальный нож ESPRADO OLA 12,5 СМ",Кухни,Кухонные аксессуары,Ножи кухонные,универсальный нож esprado ola 125 см,универсальный нож esprado ola 125 см
"Коврик для кухни. Силиконовый коврик для сушки посуды 39х25 см, серый",Кухни,Кухонные аксессуары,Коврики для кухни,коврик кухни силиконовый коврик сушки посуды 39х25 см серый,коврик кухни силиконовый коврик сушки посуды 39х25 см серый
Смеситель для кухни RAVAK KM 016.00,Кухни,Мойки и смесители для кухни,Кухонные смесители,смеситель кухни ravak km 01600,смеситель кухни ravak km 01600
Кромка в плинтус пластик 32х3050 мм Корсика,Кухни,Столешницы и комплектующие,Кромочный пластик для кухонных столешниц и плинтусов,кромка в плинтус пластик 32х3050 мм корсика,кромка в плинтус пластик 32х3050 мм корсика
"Шкаф напольный Дублин 85,6х100 см",Кухни,Мебель для кухни,Кухонные шкафы,шкаф напольный дублин 856х100 см,шкаф напольный дублин 856х100 см
Миска с крышкой IDEA М 1304 капучино 4 л,Кухни,Посуда для сервировки,Салатники,миска с крышкой idea м 1304 капучино 4 л,миска с крышкой idea м 1304 капучино 4 л
"Кабель телевизионный PROconnect RG-6U 1x0,9 кв. мм 50 м",Электрика,Телевизионное оборудование,ТВ кабель,кабель телевизионный proconnect rg-6u 1x09 кв мм 50 м,кабель телевизионный proconnect rg-6u 1x09 кв мм 50 м
Розетка антенная OBI тройная 307391,Электрика,Телевизионное оборудование,Штекеры и переходники,розетка антенная obi тройная 307391,розетка антенная obi тройная 307391
Кабель переходник REXANT UTP CAT5E 15 м,Электрика,Кабели и провода,Кабели ТВ и интернет,кабель переходник rexant utp 15 м,кабель переходник rexant utp 15 м
Рамка Schneider Electric ATLAS DESIGN NATURE ATN312204,Электрика,"Розетки, выключатели и рамки",Рамки для розеток,рамка schneider electric atlas design nature,рамка schneider electric atlas design nature
BRITE Выключатель. 1-кл. перекр. 10А ВС10-1-3-БрМ мар. IEK,Электрика,"Розетки, выключатели и рамки",Выключатели,brite выключатель 1-кл перекр 10а вс10-1-3-брм мар iek,brite выключатель 1-кл перекр 10а вс10-1-3-брм мар iek
Выключатель Legrand Valena одноклавишный 694348,Электрика,"Розетки, выключатели и рамки",Диммеры и светорегуляторы,выключатель legrand valena одноклавишный 694348,выключатель legrand valena одноклавишный 694348
Соединитель коробок Schneider Electric Multifix IMT35180 10 шт,Электрика,Кабели и провода,Распределительные коробки,соединитель коробок schneider electric multifix 10 шт,соединитель коробок schneider electric multifix 10 шт
Антенна комнатная Rexant Ag-711 цифровая и аналоговая,Электрика,Телевизионное оборудование,Антенны для ТВ,антенна комнатная rexant цифровая и аналоговая,антенна комнатная rexant цифровая и аналоговая
Координатная трубка для домофона Rexant RX-348,Электрика,Системы наблюдения и оповещения,Домофоны,координатная трубка домофона rexant,координатная трубка домофона rexant
Выключатель Legrand Valena 694261,Электрика,"Розетки, выключатели и рамки",Выключатели,выключатель legrand valena 694261,выключатель legrand valena 694261
Удлинитель У05К 5 мест с заземлением 5м 3х1мм2 16А 250В черный IEK,Электрика,"Удлинители, сетевые фильтры",Сетевые фильтры,удлинитель у05к 5 мест с заземлением 5м 3х1мм2 16а 250в черный iek,удлинитель у05к 5 мест с заземлением 5м 3х1мм2 16а 250в черный iek
Стабилизатор напряжения RUCELF СТАР-3000,Электрика,Щитовое оборудование,Стабилизаторы напряжения,стабилизатор напряжения rucelf стар-3000,стабилизатор напряжения rucelf стар-3000
Камера видеонаблюдения Rexant 45-0140 160х65 мм,Электрика,Системы наблюдения и оповещения,Камеры видеонаблюдения,камера видеонаблюдения rexant 45-0140 160х65 мм,камера видеонаблюдения rexant 45-0140 160х65 мм
Выключатель Legrand Etika 672413,Электрика,"Розетки, выключатели и рамки",Выключатели,выключатель legrand etika 672413,выключатель legrand etika 672413
"Кабель витая пара PROconnect U/UTP, CAT 5e, PVC, 4PR, 24AWG, INDOOR, SOLID, серый, 50 м",Электрика,Телевизионное оборудование,Интернет кабель,кабель витая пара proconnect u/utp cat 5e pvc 4pr 24awg indoor solid серый 50 м,кабель витая пара proconnect u/utp cat 5e pvc 4pr 24awg indoor solid серый 50 м
Набор термоусадочных трубок REXANT AUTO 2:1 10 см 10 шт,Электрика,Кабели и провода,Изоляция кабеля,термоусадочных трубок rexant auto 21 10 см 10 шт,термоусадочных трубок rexant auto 21 10 см 10 шт
Кабель-канал парапетный 80х40 мм IEK ПРАЙМЕР,Электрика,Кабели и провода,Кабель-каналы,кабель-канал парапетный 80х40 мм iek праймер,кабель-канал парапетный 80х40 мм iek праймер
Wi-Fi cмарт-камера SECURIC,Электрика,Системы наблюдения и оповещения,Камеры видеонаблюдения,wi-fi cмарт-камера securic,wi-fi cмарт-камера securic
Вилка угловая NAVIGATOR 16А с/з IP20 белая 7.9Х4.5,Электрика,"Удлинители, сетевые фильтры",Вилки штепсельные,вилка угловая navigator 16а с/з белая 79х45,вилка угловая navigator 16а с/з белая 79х45
Кабель канал ЭРА KK-30-13-GR напольный 30х13мм графит,Электрика,Кабели и провода,Кабель-каналы,кабель канал эра -gr напольный 30х13мм графит,кабель канал эра -gr напольный 30х13мм графит
Труба ПВХ Ecoplast гофрированная 16 мм 100 м серая,Электрика,Кабели и провода,Гофрированные трубы для кабеля,труба пвх ecoplast гофрированная 16 мм 100 м серая,труба пвх ecoplast гофрированная 16 мм 100 м серая
Хомут-бабочка ЕВРОПАРТНЕР D12-20 мм нержавеющая сталь 2 шт,Электрика,Кабели и провода,Крепеж проводов и кабелей,хомут-бабочка европартнер мм нержавеющая сталь 2 шт,хомут-бабочка европартнер мм нержавеющая сталь 2 шт
Кабель HDMI 2.0 3 м Gold REXANT,Электрика,Телевизионное оборудование,HDMI кабели,кабель hdmi 20 3 м gold rexant,кабель hdmi 20 3 м gold rexant
Элемент питания алкалиновый 6AAA/LR03 Professional Opticell,Электрика,Элементы питания и зарядные устройства,Батарейки,элемент питания алкалиновый 6aaa/ professional opticell,элемент питания алкалиновый 6aaa/ professional opticell
Фонарь для работы NAVIGATOR 7ВТ 2.4АЧ,Электрика,Фонари и прожекторы,Ручные фонари,фонарь работы navigator 7вт 24ач,фонарь работы navigator 7вт 24ач
Кабель HDMI 2.1 длина 2 м Gold REXANT,Электрика,Телевизионное оборудование,HDMI кабели,кабель hdmi 21 длина 2 м gold rexant,кабель hdmi 21 длина 2 м gold rexant
Фонарь светодиодный аккумуляторный REXANT 75-7822 2000 мАч,Электрика,Фонари и прожекторы,Ручные фонари,фонарь светодиодный аккумуляторный rexant 75-7822 2000 мач,фонарь светодиодный аккумуляторный rexant 75-7822 2000 мач
"Удлинитель аудио-видео REXANT TV (Male) - TV (Male) 1,5 м белый",Электрика,Телевизионное оборудование,ТВ кабель,удлинитель аудио-видео rexant tv (male) - tv (male) 15 м белый,удлинитель аудио-видео rexant tv (male) - tv (male) 15 м белый
Шина нулевая PE-N REXANT крепление края 6X9 14/2,Электрика,Щитовое оборудование,Аксессуары для электрических щитов,шина нулевая pe-n rexant крепление края 6x9 14/2,шина нулевая pe-n rexant крепление края 6x9 14/2
Кабель-канал ЭРА 16x16 белый,Электрика,Кабели и провода,Кабель-каналы,кабель-канал эра 16x16 белый,кабель-канал эра 16x16 белый
Кабель-канал 40х16 IEK ECOLINE сосна,Электрика,Кабели и провода,Кабель-каналы,кабель-канал 40х16 iek ecoline сосна,кабель-канал 40х16 iek ecoline сосна
Шина нулевая REXANT на 2-ух угловых изоляторах 14ГР-П 6X9,Электрика,Щитовое оборудование,Аксессуары для электрических щитов,шина нулевая rexant на 2-ух угловых изоляторах 14гр-п 6x9,шина нулевая rexant на 2-ух угловых изоляторах 14гр-п 6x9
Переходник угловой Rexant Gold Г - HDMI A (Female)/Ш - HDMI A (Male),Электрика,Телевизионное оборудование,Штекеры и переходники,переходник угловой rexant gold г - hdmi a (female)/ш - hdmi a (male),переходник угловой rexant gold г - hdmi a (female)/ш - hdmi a (male)
Кабель Rexant USB 1-жильный 1 м,Электрика,Элементы питания и зарядные устройства,Кабели для зарядки телефонов,кабель rexant usb 1-жильный 1 м,кабель rexant usb 1-жильный 1 м
Вилка разборная для плиты с з/к 32А IEK Впл10-К белая,Электрика,"Удлинители, сетевые фильтры",Вилки штепсельные,вилка разборная плиты с з/к 32а iek впл10-к белая,вилка разборная плиты с з/к 32а iek впл10-к белая
Стабилизатор напр. 1-ф. переносн. 3кВА HUB IEK,Электрика,Щитовое оборудование,Стабилизаторы напряжения,стабилизатор напр 1-ф переносн 3ква hub iek,стабилизатор напр 1-ф переносн 3ква hub iek
Вилка cетевая EKF PROxima 014 3Р+РЕ 380 В 16 А,Электрика,"Удлинители, сетевые фильтры",Вилки штепсельные,вилка cетевая ekf proxima 014 3р+ре 380 в 16 а,вилка cетевая ekf proxima 014 3р+ре 380 в 16 а
Стабилизатор напряжения РЕСАНТА АСН-5000Н/1-Ц,Электрика,Щитовое оборудование,Стабилизаторы напряжения,стабилизатор напряжения ресанта асн-5000н/1-ц,стабилизатор напряжения ресанта асн-5000н/1-ц
Выключатель Schneider Electric Atlas Design ATN000153,Электрика,"Розетки, выключатели и рамки",Выключатели,выключатель schneider electric atlas design,выключатель schneider electric atlas design
Кабель соединительный Rexant RJ-45-RJ-45 5 м,Электрика,Телевизионное оборудование,Интернет кабель,кабель соединительный rexant rj-45-rj-45 5 м,кабель соединительный rexant rj-45-rj-45 5 м
Щит пластиковый встраиваемый EKF 12МОД nv-pb-pd-1,Электрика,Щитовое оборудование,Распределительные щиты,щит пластиковый встраиваемый ekf 12мод nv-pb-pd-1,щит пластиковый встраиваемый ekf 12мод nv-pb-pd-1
Вилка сетевая EKF PROxima 023 2P+PE 220 В 32 A синяя,Электрика,"Удлинители, сетевые фильтры",Вилки штепсельные,вилка сетевая ekf proxima 023 2p+pe 220 в 32 a синяя,вилка сетевая ekf proxima 023 2p+pe 220 в 32 a синяя
"Фонарь универсальный, однорежимный, в алюминиевом корпусе 4Х1,2Х1,2",Электрика,Фонари и прожекторы,Ручные фонари,фонарь универсальный однорежимный в алюминиевом корпусе 4х12х12,фонарь универсальный однорежимный в алюминиевом корпусе 4х12х12
"Провод ГОСТ ПВС 2x2,5 10 м",Электрика,Кабели и провода,Силовые кабели,провод гост пвс 2x25 10 м,провод гост пвс 2x25 10 м
Звонок электрический Navigator 61 267 белый,Электрика,Системы наблюдения и оповещения,Дверные звонки,звонок электрический navigator 61 267 белый,звонок электрический navigator 61 267 белый
Выключатель Legrand Valena 695604,Электрика,"Розетки, выключатели и рамки",Выключатели,выключатель legrand valena 695604,выключатель legrand valena 695604
Антенна комнатная REXANT RX-100 аналоговая,Электрика,Телевизионное оборудование,Антенны для ТВ,антенна комнатная rexant аналоговая,антенна комнатная rexant аналоговая
Рамка Schneider Electric ATLAS DESIGN NATURE ATN312304,Электрика,"Розетки, выключатели и рамки",Рамки для розеток,рамка schneider electric atlas design nature,рамка schneider electric atlas design nature
Розетка (колодка) трехместная с защитными крышками IEK ОМЕГА РБ33-1-0м IP44 каучук красная,Электрика,"Удлинители, сетевые фильтры",Колодки для удлинителей,розетка (колодка) трехместная с защитными крышками iek омега рб33-1-0м каучук красная,розетка (колодка) трехместная с защитными крышками iek омега рб33-1-0м каучук красная
Реле напряжения PROxima MRV 63A с дисплеем,Электрика,Щитовое оборудование,Реле напряжения,реле напряжения proxima mrv 63a с дисплеем,реле напряжения proxima mrv 63a с дисплеем
Чехол LUX-TOOLS для гладильной доски 122х37см в асcортименте,Хозяйственные товары,Товары для ухода за одеждой и обувью,Чехлы для гладильной доски,чехол lux-tools гладильной доски 122х37см в асcортименте,чехол lux-tools гладильной доски 122х37см в асcортименте
"Кондиционер Synergetic для белья Аромамагия 1,5 л",Хозяйственные товары,Товары для ухода за одеждой и обувью,Кондиционеры и ополаскиватели,кондиционер synergetic белья аромамагия 15 л,кондиционер synergetic белья аромамагия 15 л
"Гель Synergetic для стирки детского белья 2,75 л",Хозяйственные товары,Товары для стирки,Гели для стирки,гель synergetic стирки детского белья 275 л,гель synergetic стирки детского белья 275 л
Средство универсальное VASH GOLD 307352 500 мл,Хозяйственные товары,Бытовая химия,Средства для туалета и ванной,средство универсальное vash gold 307352 500 мл,средство универсальное vash gold 307352 500 мл
Губка универсальная TRENDTIME «PROFESSIONAL» 165х95х45мм,Хозяйственные товары,Товары для уборки,"Губки, тряпки, салфетки для уборки",губка универсальная trendtime «professional» 165х95х45мм,губка универсальная trendtime «professional» 165х95х45мм
Перчатки хозяйственные Vileda Comfort and Care S,Хозяйственные товары,Товары для уборки,Перчатки для уборки,перчатки хозяйственные vileda comfort and care s,перчатки хозяйственные vileda comfort and care s
"Сушилка для белья металлическая JOY Home 54х75 см, черный",Хозяйственные товары,Товары для ухода за одеждой и обувью,Сушилки для белья,сушилка белья металлическая joy home 54х75 см черный,сушилка белья металлическая joy home 54х75 см черный
"Ведро для мытья полов 12л, мятный",Хозяйственные товары,Товары для уборки,Ведра и тазы для уборки,ведро мытья полов 12л мятный,ведро мытья полов 12л мятный
Мешок КАЛИБР 2 шт,Хозяйственные товары,Техника для дома,Аксессуары для пылесосов,мешок калибр 2 шт,мешок калибр 2 шт
"Сушилка для белья стальная GIMI 80х19 см, белый",Хозяйственные товары,Товары для ухода за одеждой и обувью,Сушилки для белья,сушилка белья стальная gimi 80х19 см белый,сушилка белья стальная gimi 80х19 см белый
